{
  "problem_id": "P02",
  "final_answer": {
    "value": 1.85,
    "units": "g",
    "precision_note": "3 significant figures based on input data precision (5.00 g, 84.0%)"
  },
  "method": "Calculate the mass of CaCO3 in the sample: 5.00 g × 0.840 = 4.20 g. Calculate moles of CaCO3: n = m / Mr = 4.20 / 100.1 = 0.04196 mol. From the balanced equation CaCO3 + 2HCl → CaCl2 + CO2 + H2O, the mole ratio of CaCO3 to CO2 is 1:1. Therefore moles of CO2 = 0.04196 mol. Calculate mass of CO2: m = n × Mr = 0.04196 × 44.0 = 1.846 g, rounded to 1.85 g.",
  "key_equations": [
    "Moles: n = m / Mr",
    "Stoichiometry: CaCO3 + 2HCl -> CaCl2 + CO2 + H2O (1:1 mole ratio)",
    "Mr(CaCO3) = 100.1, Mr(CO2) = 44.0"
  ],
  "line_refs": [
    "L14",
    "L24",
    "L25",
    "L26",
    "L33",
    "L34",
    "L35",
    "L36"
  ],
  "checks": [
    "Mass of CaCO3 (4.20 g) ÷ Mr (100.1) = 0.0420 mol × 44.0 g/mol = 1.85 g CO2",
    "Purity calculation: 84% of 5.00 g = 4.20 g CaCO3 is reasonable",
    "Mole ratio verification: 1 mol CaCO3 produces exactly 1 mol CO2"
  ]
}