{
  "problem_id": "P01",
  "final_answer": {
    "value": 0.0200,
    "units": "mol dm-3",
    "precision_note": "Given data are 3 s.f.; concentration reported as 0.0200 (3 s.f.)."
  },
  "method": "Use the dilution relationship c1V1 = c2V2. Here c1 = 0.200 mol dm-3 and V1 = 25.0 cm3, diluted to V2 = 250.0 cm3. Because both volumes are in cm3, their ratio is unchanged (no need to convert to dm3). Rearrange to c2 = (c1V1)/V2 = (0.200 × 25.0)/250.0 = 0.0200 mol dm-3.",
  "key_equations": [
    "c1V1 = c2V2",
    "c2 = (c1V1)/V2"
  ],
  "line_refs": [
    "L16",
    "L29"
  ],
  "checks": [
    "The volume increased by a factor of 10, so concentration should decrease by a factor of 10 (0.200→0.0200).",
    "Units remain mol dm-3 because dilution changes concentration, not the substance."
  ]
}