{
  "problem_id": "P01",
  "final_answer": {
    "value": 0.02,
    "units": "mol dm-3",
    "precision_note": "Given values are 3 s.f., so the diluted concentration is reported as 0.0200 mol dm-3 (stored numerically as 0.02)."
  },
  "method": "Use the dilution relationship c1V1 = c2V2. Substitute c1 = 0.200 mol dm-3, V1 = 25.0 cm3, and V2 = 250.0 cm3. So c2 = (0.200 x 25.0) / 250.0 = 0.0200 mol dm-3. The concentration falls by a factor of 10 because the volume increases tenfold from 25.0 to 250.0 cm3.",
  "key_equations": [
    "c1V1 = c2V2",
    "c2 = (c1V1)/V2"
  ],
  "line_refs": ["L16", "L29", "L30"],
  "checks": [
    "Final volume is 10 times larger, so concentration should be one-tenth.",
    "0.200/10 = 0.0200 mol dm-3, matching the computed value."
  ]
}