{
  "problem_id": "P02",
  "final_answer": {
    "value": 1.85,
    "units": "g",
    "precision_note": "3 s.f. based on given masses/percentages"
  },
  "method": "Mass of CaCO3 in the limestone = 5.00 g × 0.840 = 4.20 g. Use the atomic data to get Mr values: Mr(CaCO3)=40.1 + 12.0 + 3×16.0 = 100.1, and Mr(CO2)=12.0 + 2×16.0 = 44.0. Moles of CaCO3: n = m/Mr = 4.20/100.1 = 0.04196 mol. From CaCO3 + 2HCl → CaCl2 + CO2 + H2O, the mole ratio CaCO3:CO2 is 1:1, so n(CO2)=0.04196 mol. Mass of CO2 = n×Mr = 0.04196×44.0 = 1.846 g, which rounds to 1.85 g.",
  "key_equations": [
    "n = m / Mr",
    "m = n × Mr",
    "CaCO3 : CO2 = 1 : 1 (from the balanced equation)"
  ],
  "line_refs": [
    "L33",
    "L34",
    "L14",
    "L24"
  ],
  "checks": [
    "Only 4.20 g of CaCO3 is present, and 100.1 g CaCO3 gives 44.0 g CO2, so expected CO2 mass ≈ 4.20×(44.0/100.1) ≈ 1.85 g.",
    "Acid is in excess, so CaCO3 is the limiting reagent, consistent with using only its moles to find CO2."
  ]
}
