{
  "problem_id": "P06",
  "final_answer": {
    "value": 0.0736,
    "units": "",
    "precision_note": "Using three significant figures from equilibrium data, Kc is dimensionless as specified in report"
  },
  "method": "Calculate equilibrium concentrations using moles and vessel volume of 2.00 dm3: [NO2] = moles(NO2) / V = 0.180 / 2.00 = 0.0900 mol dm-3, and [N2O4] = moles(N2O4) / V = 0.220 / 2.00 = 0.110 mol dm-3. Apply the equilibrium constant expression for N2O4(g) <-> 2NO2(g): Kc = [NO2]^2 / [N2O4]. Substitute the concentrations: Kc = (0.0900)^2 / 0.110 = 0.00810 / 0.110 = 0.0736. The dimensionless Kc value confirms the equilibrium position favors the reactant N2O4.",
  "key_equations": [
    "Kc = [NO2]^2 / [N2O4]",
    "Concentration calculation: c = n / V",
    "Equilibrium expression for N2O4 <-> 2NO2"
  ],
  "line_refs": [
    "L57",
    "L58",
    "L20",
    "L21"
  ],
  "checks": [
    "Concentrations calculated correctly: NO2 = 0.180/2.00 = 0.0900, N2O4 = 0.220/2.00 = 0.110",
    "Kc = (0.0900)^2 / 0.110 = 0.00810/0.110 = 0.0736",
    "Kc value less than 1 indicates equilibrium favors reactants (N2O4)"
  ]
}