{
  "problem_id": "P02",
  "final_answer": {
    "value": 1.85,
    "units": "g",
    "precision_note": "Answer given to 3 significant figures, consistent with the precision of the input mass and percentage values."
  },
  "method": "First, calculate the mass of pure CaCO3 in the limestone sample: 5.00 g × 0.840 = 4.20 g. Then convert to moles using Mr(CaCO3) = 100.1: n(CaCO3) = 4.20 / 100.1 = 0.04196 mol. From the balanced equation, 1 mol CaCO3 produces 1 mol CO2, so n(CO2) = 0.04196 mol. Finally, calculate the mass using Mr(CO2) = 44.0: mass CO2 = 0.04196 × 44.0 = 1.85 g.",
  "key_equations": [
    "n = m / Mr",
    "mass = n × Mr"
  ],
  "line_refs": ["L14", "L25", "L26", "L33"],
  "checks": [
    "Using stoichiometry ratio of 1:1 for CaCO3 to CO2, the maximum theoretical yield is correctly calculated from the pure CaCO3 mass."
  ]
}